{
  "schemaVersion": "1.0.0",
  "query": "에어팟 프로3",
  "sort": "latest",
  "collectedAt": "2026-08-19T05:20:24.447085+00:00",
  "count": 20,
  "failedCount": 0,
  "products": [
    {
      "platform": "NAVER_FLEAMARKET",
      "platformProductId": "01M0AJ53MD7HMTWK6J5HG62F9E",
      "url": "https://fleamarket.naver.com/market-products/01M0AJ53MD7HMTWK6J5HG62F9E",
      "title": "[A급/풀박스] 에어팟 프로3",
      "productName": "에어팟 프로 3세대 MFHP4KH/A USB-C 노이즈캔슬링",
      "description": "《에어팟은 사진으로 구분하기 힘든 정교한 가품이 매우 많습니다! 반드시 직거래나 안심결제로 구매하셔서 노이즈 캔슬링, 음질 등을 체크 후 구매 확정 하시는 걸 강력히 권장드립니다》 \n\n연말에 일렉트로마트에서 호기심으로 구매 후 거의 서랍에만 박아둔 물건입니다. 원래 사용하던 젠하이저 이어폰 음색이 더 마음에 들어 방출합니다. \n\n사용 횟수가 양손에 꼽을 정도이다보니, 상태는 사진에 보시다시피 전체적으로 깔끔합니다. 기능 및 배터리 상태 이상 없는 것 확인하였으며, 보증도 10월까지 남아있습니다. \n\n구성은 풀박스(박스 + 본체 + 이어팁 세트)입니다. 사진 여러 각도로 올려놓았으나 필요하신 경우 더 찍어 보내드릴 수 있으니 궁금하신 점 편하게 문의 주세요.\n\n수원 CU 영통하우스토리점 앞에서 직거래 가능하며, 택배 거래 시 배송비 추가됩니다. \n\n\n✅️ 직거래 희망하실 경우 챗 주시고, 안심결제 희망하실 경우 특별한 문의사항 없으시면 바로 결제해주시면 됩니다. \n\n🚫 마일리지 운운 하며 가짜 중고거래 사이트로 유도하는 사기 안 통합니다. 사기꾼 분들은 서로 시간 낭비 없도록 연락 자제 부탁드립니다.",
      "price": 250000,
      "originalPrice": 250000,
      "quantity": 1,
      "saleStatus": "SELLING",
      "condition": "LIKE_NEW",
      "conditionLabel": "사용감 거의 없음",
      "brand": "Apple",
      "catalogProductId": "01K6ASMWWP651S7CAA5J7BPPFF",
      "category": "이어폰/이어셋",
      "categories": [
        "디지털/가전",
        "음향가전",
        "이어폰/이어셋"
      ],
      "attributes": null,
      "package": {
        "hasOriginalBox": true,
        "hasWarranty": false
      },
      "trade": {
        "paymentType": "FLEA_SAFETY",
        "safetyPaymentAvailable": true,
        "transactionOfferAvailable": true,
        "buyerProtectionFeeRate": 2.2,
        "shipping": {
          "available": true,
          "fee": 3600,
          "feePayer": "BUYER",
          "remoteAreaExtraFee": 5000,
          "freeShipping": false,
          "methods": [
            {
              "type": "PICKUP_DELIVERY",
              "fee": 3600,
              "feePayer": "BUYER",
              "remoteAreaExtraFee": 5000
            }
          ]
        },
        "inPerson": {
          "available": true,
          "locations": [
            {
              "name": "영통동",
              "regionCode": "02117105"
            }
          ]
        }
      },
      "metrics": {
        "favoriteCount": 1,
        "viewCount": null,
        "chatCount": null
      },
      "images": [
        "https://nflea-phinf.pstatic.net/MjAyNjA4MThfMjA5/MDAxNzg3MDYwOTM5OTE1.eKeObKL0Dg31sVYYyeTynn-UhOJ1S92icwEbhZosvWUg.emNOFD6oBXb2vRoUA6BBXn3Ip7g-0wtuuQZJ9oxCMpMg.JPEG/1000265289.jpg",
        "https://nflea-phinf.pstatic.net/MjAyNjA4MThfMTUy/MDAxNzg3MDYwOTQwODY5.kYaR4vBx8Ab5ixzM0AuWd7JzDvDcAYnFEv351xfUv_Ag.AKJe4t-1yC4HvVQV794nBGIX0-gaExEQ8T98MftD_l4g.JPEG/1000265285.jpg",
        "https://nflea-phinf.pstatic.net/MjAyNjA4MThfMjk4/MDAxNzg3MDYwOTQxODIw.pSIwmU6wSDBJ3OrFN1qGvxySJJcIJvvXIvUYG8Gyq0Ug.4bRZiJWHVo5hUUAUpe9tta2T_MTs0c5xQShmoxM7hZgg.JPEG/1000265286.jpg",
        "https://nflea-phinf.pstatic.net/MjAyNjA4MThfMTE3/MDAxNzg3MDYwOTQyODU0.TVpJbCTw7W6z_1aI57kjQoO2-_mIujqGRFJiMb50XL0g.zZBIB-R7EDwiDxGKNcsmflI9bWPECEEv1COkO_iJYxcg.JPEG/1000265287.jpg",
        "https://nflea-phinf.pstatic.net/MjAyNjA4MThfNjMg/MDAxNzg3MDYwOTQzODA4.UFRrG2CP_dZF1qv4hVjr0H4ZQ2L1Ivn9xYuUpwzTfqUg.SWro4nlYVGYMQjflEpj51W4PIkZ8nVJBKPxEvwR6ehkg.JPEG/1000265293.jpg",
        "https://nflea-phinf.pstatic.net/MjAyNjA4MThfMTI0/MDAxNzg3MDYwOTQ0NzMx.iSZ6wUHw3RgllCPUKAkktX7VkZPadBLUwMBuaQZvZMQg.AI3OcKpoaqh0WCRLxSTEXWp1lHCwG_GHOoBn4vmwk-Mg.JPEG/1000265295.jpg",
        "https://nflea-phinf.pstatic.net/MjAyNjA4MThfMTg1/MDAxNzg3MDYwOTQ1NzI4.BM8rs-wJPhX96_1zT4dXQOHA7nVPiJOT7zG-3K9sDNkg.j0ijOdeLGUfvz__WCXGHoO1mYgs4wY29DRZhFxOBqKIg.JPEG/1000265297.jpg",
        "https://nflea-phinf.pstatic.net/MjAyNjA4MThfMTYy/MDAxNzg3MDYwOTQ2OTM1.VstHfLN5oVP_j8_x3811IEzjYxQffNn8du4zNutpdgcg.H4WdEcZLqh8QVay7xsyZhxY3fuCUa7G6Y0H7JroDzb8g.JPEG/1000265299.jpg",
        "https://nflea-phinf.pstatic.net/MjAyNjA4MThfMjY0/MDAxNzg3MDYwOTQ4MTA4.Ciw6Z65KM8uste2TIQdoktqXeFOYYuMFKI4iAL-m6Oog.cAh7KxzKjAjG4XdpriszeRzVL3993i38Fz1lCSY0plcg.JPEG/1000265300.jpg",
        "https://nflea-phinf.pstatic.net/MjAyNjA4MThfMTY4/MDAxNzg3MDYwOTQ5MDk0.F7kJH5CKvfMspst5xp260FjclE5uDHAgAStbDh3xMvwg.UdAwPrYdHlkxZOPfCbT3WpiKoDppbqVncHugUrBXjVUg.JPEG/1000265302.jpg"
      ],
      "seller": {
        "name": "루페르칼리아",
        "profileId": "01K5XFP2WG36XM1HYNBHSNEM00",
        "reviewRating": 5.0,
        "reviewCount": 8,
        "salesCount": 12,
        "isProshop": false,
        "verified": true
      },
      "createdAt": "2026-08-18T13:49:41.389000+00:00",
      "updatedAt": "2026-08-18T13:49:41.352000+00:00",
      "source": {
        "isSearchAd": false,
        "purchaseVerified": false,
        "isCrossPosted": false,
        "originalMarketName": null,
        "originalMarketProductUrl": null
      }
    },
    {
      "platform": "NAVER_FLEAMARKET",
      "platformProductId": "01M09TYDNX01T6A78HW607Y140",
      "url": "https://fleamarket.naver.com/market-products/01M09TYDNX01T6A78HW607Y140",
      "title": "Apple 에어팟 프로 3세대 MFHP4KH/A USB-C 노이즈캔슬링 화이트",
      "productName": "에어팟 프로 3세대 MFHP4KH/A USB-C 노이즈캔슬링",
      "description": "중고제품이며 정품입니다.\n케이스 끼고 다녀서 흠집없습니다\n직거래 가능",
      "price": 230000,
      "originalPrice": 230000,
      "quantity": 1,
      "saleStatus": "SELLING",
      "condition": "LIKE_NEW",
      "conditionLabel": "사용감 거의 없음",
      "brand": "Apple",
      "catalogProductId": "01K6ASMWWP651S7CAA5J7BPPFF",
      "category": "이어폰/이어셋",
      "categories": [
        "디지털/가전",
        "음향가전",
        "이어폰/이어셋"
      ],
      "attributes": null,
      "package": {
        "hasOriginalBox": true,
        "hasWarranty": false
      },
      "trade": {
        "paymentType": "FLEA_SAFETY",
        "safetyPaymentAvailable": true,
        "transactionOfferAvailable": false,
        "buyerProtectionFeeRate": 2.2,
        "shipping": {
          "available": false,
          "fee": null,
          "feePayer": null,
          "remoteAreaExtraFee": null,
          "freeShipping": null,
          "methods": null
        },
        "inPerson": {
          "available": true,
          "locations": [
            {
              "name": "부평동",
              "regionCode": "11237101"
            }
          ]
        }
      },
      "metrics": {
        "favoriteCount": 0,
        "viewCount": null,
        "chatCount": null
      },
      "images": [
        "https://nflea-phinf.pstatic.net/MjAyNjA4MThfMTI1/MDAxNzg3MDM2NTM1MjM4.lcg_xWMspVgmsyRR9P3k_newPPFs9oIrdHo4n5fL0wcg.5NQB85emRX3FvFNRt3UK0FpWtC4zWVUt5KxEkHBQVeMg.JPEG/image.jpg"
      ],
      "seller": {
        "name": "dhk87874",
        "profileId": "01M09THQ3TVEC5CYRYT9VR1EYX",
        "reviewRating": 0.0,
        "reviewCount": 0,
        "salesCount": 0,
        "isProshop": false,
        "verified": true
      },
      "createdAt": "2026-08-18T07:04:05.053000+00:00",
      "updatedAt": "2026-08-18T07:04:05.035000+00:00",
      "source": {
        "isSearchAd": false,
        "purchaseVerified": false,
        "isCrossPosted": false,
        "originalMarketName": null,
        "originalMarketProductUrl": null
      }
    },
    {
      "platform": "NAVER_FLEAMARKET",
      "platformProductId": "01KZZV1521Z20YB7B37THNF8N4",
      "url": "https://fleamarket.naver.com/market-products/01KZZV1521Z20YB7B37THNF8N4",
      "title": "미개봉) 에어팟프로3 팔아요",
      "productName": "에어팟프로3 미개봉 팝니다",
      "description": "에어팟프로3 미개봉 팝니다\n\n4월 제조입니다",
      "price": 280000,
      "originalPrice": 280000,
      "quantity": 1,
      "saleStatus": "SELLING",
      "condition": "NEW",
      "conditionLabel": "미사용 새 상품",
      "brand": "애플",
      "catalogProductId": "$undefined",
      "category": "이어폰/헤드폰액세서리",
      "categories": [
        "디지털/가전",
        "음향가전",
        "이어폰/헤드폰액세서리"
      ],
      "attributes": null,
      "package": {
        "hasOriginalBox": false,
        "hasWarranty": false
      },
      "trade": {
        "paymentType": "FLEA_SAFETY",
        "safetyPaymentAvailable": true,
        "transactionOfferAvailable": false,
        "buyerProtectionFeeRate": 2.2,
        "shipping": {
          "available": true,
          "fee": 3600,
          "feePayer": "BUYER",
          "remoteAreaExtraFee": 5000,
          "freeShipping": false,
          "methods": [
            {
              "type": "PICKUP_DELIVERY",
              "fee": 3600,
              "feePayer": "BUYER",
              "remoteAreaExtraFee": 5000
            }
          ]
        },
        "inPerson": {
          "available": true,
          "locations": [
            {
              "name": "황금동",
              "regionCode": "06260107"
            }
          ]
        }
      },
      "metrics": {
        "favoriteCount": 0,
        "viewCount": null,
        "chatCount": null
      },
      "images": [
        "https://nflea-phinf.pstatic.net/MjAyNjA4MTRfMjg2/MDAxNzg2NzAxMTQ1Nzc0.fQxUSt4MjdWO8Iki0olnQbghXgyKXWMGaJlQLW5TV6Mg.ob-UiqETY842KBVCuCLbUTtfUHqXlVU_COO_eCWAd38g.JPEG/%EC%97%90%EC%96%B4%ED%8C%9F%ED%94%84%EB%A1%9C3.jpg"
      ],
      "seller": {
        "name": "윤구대",
        "profileId": "01KRBS9SX5XSWKQBBRKC63YSJM",
        "reviewRating": 0.0,
        "reviewCount": 0,
        "salesCount": 0,
        "isProshop": false,
        "verified": true
      },
      "createdAt": "2026-08-14T09:53:10.209000+00:00",
      "updatedAt": "2026-08-14T09:53:10.197000+00:00",
      "source": {
        "isSearchAd": false,
        "purchaseVerified": false,
        "isCrossPosted": false,
        "originalMarketName": null,
        "originalMarketProductUrl": null
      }
    },
    {
      "platform": "NAVER_FLEAMARKET",
      "platformProductId": "01KZMYSKDX0Y4Y0B0Z3619V4AW",
      "url": "https://fleamarket.naver.com/market-products/01KZMYSKDX0Y4Y0B0Z3619V4AW",
      "title": "Apple 에어팟 프로 3세대 MFHP4KH/A USB-C 노이즈캔슬링 화이트",